{
 "analysis_at": "2026-10-21T12:00:00Z",
 "event_at": "2026-10-21T12:00:00Z",
 "analysis_time_precision": "minute",
 "coverage": {
  "abstract": "read",
  "introduction": "read",
  "methods": "read",
  "results": "read",
  "figures": "captions_only",
  "tables": "not_present",
  "discussion": "read",
  "limitations": "read",
  "supplementary": "not_present"
 },
 "event_id": "FTR-20261021-24953239-01",
 "evidence_basis": [
  "coverage_map",
  "dossier",
  "Whole PMC XML body read; Figure 5 opened as an image (deposit jpg about 114 ppi); Figures 1 to 4 and 6 read as captions with their statistics. Depth partial."
 ],
 "evidence_depth": "partial_fulltext_read",
 "outputs": [
  "disease-models/wwox/research/deepdive_manifests/PMID24953239.json",
  "disease-models/wwox/research/repurposing_10h_scientist-b_20261021.md"
 ],
 "prior_receipt": null,
 "record_kind": "contemporaneous_receipt",
 "reread_reason": "first_read",
 "source_fingerprint": "e740709956fa13e6ce38dedc976a6775aa83f47287afa87a52d262c4ea953f5e",
 "source_kind": "fulltext_local",
 "source_locator": "files/fulltext/PMID24953239_Kanyshkova2015_PMC_r2.xml",
 "study_id": {
  "doi": "10.1007/s00424-014-1549-4",
  "pmid": "24953239"
 },
 "workflow": "scientist-b repurposing batch R2 2026-10-21; QUESTION_DRIVEN (the reader held DL-MECH-170 and CLAIM 016 before opening the paper); NOT WWOX EVIDENCE; PMC efetch XML acquired with no User-Agent through pmc_bucket_fetch.py; prepared as JSON for the integrator and staged, not appended."
}