{
 "analysis_at": "2026-10-23T20:35:08Z",
 "event_at": "2026-10-23T20:35:08Z",
 "analysis_time_precision": "minute",
 "coverage": {
  "abstract": "read",
  "introduction": "read",
  "methods": "read",
  "results": "read",
  "figures": "unavailable",
  "tables": "not_read",
  "discussion": "read",
  "limitations": "not_present",
  "supplementary": "not_present"
 },
 "event_id": "FTR-20261023-23611579-01",
 "evidence_basis": [
  "coverage_map",
  "work_manifest",
  "Whole JATS body text read section by section (Introduction, Methods, Results, Discussion); Figures 1 and 2 are declared but could not be fetched, Table 1 not opened, so depth is partial. Row Q-N-08 context QUESTION_DRIVEN. NOT WWOX EVIDENCE (congenital lactic acidosis cohort); no dose, administration or suitability is drawn from it."
 ],
 "evidence_depth": "partial_fulltext_read",
 "outputs": [
  "disease-models/wwox/research/deepdive_manifests/PMID23611579.json",
  "disease-models/wwox/research/module_batch_selection_scientist-b_20261023.md"
 ],
 "prior_receipt": null,
 "record_kind": "contemporaneous_receipt",
 "reread_reason": "first_read",
 "source_fingerprint": "cad83082b7c125b8b28e861703f904280c8007c580ffe58f1ad950e170076376",
 "source_kind": "fulltext_local",
 "source_locator": "files/fulltext/PMID23611579_Abdelmalak2013_PMC_r2.xml",
 "study_id": {
  "doi": "10.1016/j.ymgme.2013.03.019",
  "pmid": "23611579"
 },
 "workflow": "scientist-b module batch MODULE-B-20261023 (row-driven read); PMC efetch XML acquired with pmc_bucket_fetch.py 2026-10-23, locators captured while the document was open and verified by deepdive_manifest.py; prepared as JSON for the integrator and staged, not appended. NOT WWOX EVIDENCE."
}