{
 "record_kind": "contemporaneous_receipt",
 "event_id": "FTR-20261019-35571988-01",
 "study_id": {
  "pmid": "35571988",
  "doi": "10.1093/noajnl/vdac045"
 },
 "event_at": "2026-10-19T18:08:04Z",
 "analysis_at": "2026-10-19T18:08:04Z",
 "analysis_time_precision": "second",
 "workflow": "scientist-c, metabolic batch 2026-10-19, task METAB-G3-C-20261019, branch task/METAB-G3-C-20261019; context_policy SOURCE_FIRST. Route: Europe PMC REST fullTextXML (open access) saved to the shared checkout files/fulltext; whole article read from a text rendering of the JATS; two figure images and the supplementary workbook (seven sheets, read as a derived text dump) taken from the Europe PMC supplementaryFiles bundle. Receipt prepared as staged JSON for the integrator and was not appended at preparation time.",
 "evidence_depth": "complete_fulltext_read",
 "source_locator": "files/fulltext/PMID35571988_Li2022_PMC.xml",
 "source_fingerprint": "c82f4f98541cc35bfd3655ccc92b48522d8f28e0ba95845d80bade029f377f35",
 "source_kind": "fulltext_local",
 "coverage": {
  "abstract": "read",
  "introduction": "read",
  "methods": "read",
  "results": "read",
  "figures": "read",
  "tables": "read",
  "discussion": "read",
  "limitations": "read",
  "supplementary": "read",
  "references": "read"
 },
 "outputs": [
  "disease-models/wwox/research/deepdive_manifests/PMID35571988.json",
  "disease-models/wwox/research/metabolic_wave_20261019_scientist-c.md",
  "disease-models/wwox/research/commit_candidates/CC-20261019-SCIENTIST-C-G3-01.md"
 ],
 "evidence_basis": [
  "coverage_map",
  "work_manifest",
  "verbatim_locators",
  "Table 3 reaches the text rendering flattened (genotype counts run together); no count from it is carried into any locator."
 ],
 "prior_receipt": null,
 "reread_reason": "first_read"
}