{
 "analysis_at": "2026-10-20T00:00:00Z",
 "event_at": "2026-10-20T00:00:00Z",
 "analysis_time_precision": "minute",
 "coverage": {
  "abstract": "read",
  "introduction": "read",
  "methods": "read",
  "results": "read",
  "figures": "read",
  "tables": "read",
  "discussion": "read",
  "limitations": "not_present",
  "supplementary": "captions_only"
 },
 "event_id": "FTR-20261019-21075834-01",
 "evidence_basis": [
  "Whole JATS body, Tables 1, Figures 1-5 opened as images (Figure 1 via a render of the PDF page); supplement Tables S1 and S2 read as text, Figures S1 to S4 read as captions only (not rendered), hence supplementary captions_only.",
  "NEW: Idh genetic interaction is significant in 2 of 5 (RNAi) and 3 of 5 (over-expression) replicates in Table S2, Idh protein change is -12 to -19 percent, correlation uses repeated measures per line, ROS curve has no error bars."
 ],
 "evidence_depth": "partial_fulltext_read",
 "outputs": [
  "disease-models/wwox/research/deepdive_manifests/PMID21075834.json",
  "disease-models/wwox/research/fulltext_dossiers/PMID21075834.md",
  "disease-models/wwox/research/gold_wave_20261019_scientist-b.md"
 ],
 "prior_receipt": "FTR-20260811-21075834-01",
 "record_kind": "contemporaneous_receipt",
 "reread_reason": "new_version_or_supplement",
 "source_fingerprint": "dc52cb20b22601cf4dbac02cdd7de69d18af4c8360339375c7ffca0be608bd5a",
 "source_kind": "fulltext_local",
 "source_locator": "files/fulltext/PMID21075834_OKeefe2011_PMC_r2.xml",
 "study_id": {
  "doi": "10.1093/hmg/ddq495",
  "pmid": "21075834"
 },
 "workflow": "scientist-b gold wave 2026-10-19; QUESTION_DRIVEN re-read; bytes re-acquired with no User-Agent; prepared as JSON for the integrator and not appended."
}