{
 "event_id": "FTR-20261021-41784472-01",
 "record_kind": "contemporaneous_receipt",
 "study_id": {
  "pmid": "41784472",
  "doi": "10.1002/epi.70164"
 },
 "event_at": "2026-10-21T22:16:44Z",
 "analysis_at": "2026-10-21T00:00:00Z",
 "analysis_time_precision": "date_only",
 "workflow": "scientist-d, ten-hour repurposing batch, task REPURP-10H-R4-D-20261021, branch task/repurp-r4-d; context_policy QUESTION_DRIVEN. Route: Europe PMC REST fullTextXML into the shared files/fulltext/; JATS body and tables read section by section from a text rendering; Figures 1-4 opened as page renders or the whole-figure raster (400 dpi pages for the data figures); the supplementary appendix docx was read as text and its two embedded images were opened. Locators captured into the manifest and verified by deepdive_manifest.py --verify-artifacts. Receipt staged for the integrator, not appended.",
 "evidence_depth": "complete_fulltext_read",
 "source_locator": "files/fulltext/PMID41784472_Sullivan2026_PMC.xml",
 "source_fingerprint": "7da54fe978234e24152d754a67895783a7b76306b8e4982dfb6ef9a272155d12",
 "source_kind": "fulltext_local",
 "coverage": {
  "abstract": "read",
  "introduction": "read",
  "methods": "read",
  "results": "read",
  "figures": "read",
  "tables": "read",
  "discussion": "read",
  "limitations": "read",
  "supplementary": "read"
 },
 "outputs": [
  "disease-models/wwox/research/deepdive_manifests/PMID41784472.json",
  "disease-models/wwox/research/repurposing_10h_scientist-d_20261021.md"
 ],
 "evidence_basis": [
  "coverage_map",
  "JATS text rendering read in full including Tables 1-2; Figures 1-4 and supplementary Figures S1-S2 inspected as images; supplementary Tables S1-S3 read from the docx text."
 ],
 "prior_receipt": null,
 "reread_reason": "first_read"
}