{
 "event_id": "FTR-20261021-41237355-01",
 "record_kind": "contemporaneous_receipt",
 "study_id": {
  "pmid": "41237355",
  "doi": "10.1212/WNL.0000000000214388"
 },
 "event_at": "2026-10-21T22:42:45Z",
 "analysis_at": "2026-10-21T00:00:00Z",
 "analysis_time_precision": "date_only",
 "workflow": "scientist-d, ten-hour repurposing batch, task REPURP-10H-R4-D-20261021, branch task/repurp-r4-d; context_policy QUESTION_DRIVEN. Route: Europe PMC REST fullTextXML into the shared files/fulltext/; JATS body and tables read section by section from a text rendering; Figures 1-3 opened as the native JPEGs; the supplementary eTables and eFigures the text cites are not in the PMC bucket for this record and were not obtained (declared unavailable). Locators captured into the manifest and verified by deepdive_manifest.py --verify-artifacts. Receipt staged for the integrator, not appended.",
 "evidence_depth": "complete_fulltext_read",
 "source_locator": "files/fulltext/PMID41237355_Sullivan2025_PMC_r2.xml",
 "source_fingerprint": "b83971979e38b7960c6b40b677c1c4345d31a44631e412005ae0b2076574c08c",
 "source_kind": "fulltext_local",
 "coverage": {
  "abstract": "read",
  "introduction": "read",
  "methods": "read",
  "results": "read",
  "figures": "read",
  "tables": "read",
  "discussion": "read",
  "limitations": "read",
  "supplementary": "unavailable"
 },
 "outputs": [
  "disease-models/wwox/research/deepdive_manifests/PMID41237355.json",
  "disease-models/wwox/research/repurposing_10h_scientist-d_20261021.md"
 ],
 "evidence_basis": [
  "coverage_map",
  "JATS text rendering read in full including Tables 1-4; Figures 1-3 inspected as images; eTables and eFigures cited in the text were not obtainable."
 ],
 "prior_receipt": null,
 "reread_reason": "first_read"
}