{
 "event_id": "FTR-20261021-39762914-01",
 "record_kind": "contemporaneous_receipt",
 "study_id": {
  "pmid": "39762914",
  "doi": "10.1186/s13023-024-03495-1"
 },
 "event_at": "2026-10-21T22:29:56Z",
 "analysis_at": "2026-10-21T00:00:00Z",
 "analysis_time_precision": "date_only",
 "workflow": "scientist-d, ten-hour repurposing batch, task REPURP-10H-R4-D-20261021, branch task/repurp-r4-d; context_policy QUESTION_DRIVEN. Route: Europe PMC REST fullTextXML into the shared files/fulltext/; JATS body and tables read section by section from a text rendering; Figure 1 opened as the native JPEG; the 110-page protocol was read only in its timeline, interim-analysis and sample-size sections from the text layer. Locators captured into the manifest and verified by deepdive_manifest.py --verify-artifacts. Receipt staged for the integrator, not appended.",
 "evidence_depth": "partial_fulltext_read",
 "source_locator": "files/fulltext/PMID39762914_Driedger2025_PMC.xml",
 "source_fingerprint": "fc7b8491bb125e0a2a550d5897a3e44a5630ec5f773491deca14be0aaf66c8e8",
 "source_kind": "fulltext_local",
 "coverage": {
  "abstract": "read",
  "introduction": "read",
  "methods": "read",
  "results": "not_present",
  "figures": "read",
  "tables": "read",
  "discussion": "read",
  "limitations": "not_present",
  "supplementary": "captions_only"
 },
 "outputs": [
  "disease-models/wwox/research/deepdive_manifests/PMID39762914.json",
  "disease-models/wwox/research/repurposing_10h_scientist-d_20261021.md"
 ],
 "evidence_basis": [
  "coverage_map",
  "JATS text rendering read in full including Tables 1-3; Figure 1 inspected as an image; supplementary protocol read only in sections 3.3-3.4 and 9.6-9.9; no results exist in a protocol paper."
 ],
 "prior_receipt": null,
 "reread_reason": "first_read"
}